{
  "project": "<PROJECT_NAME>",
  "phase": "<PHASE_ID>",
  "requestedBy": "<REQUESTER>",
  "targetEnvironment": "staging",
  "targetUrl": "URL_PLACEHOLDER",
  "branch": "<BRANCH>",
  "commit": "<COMMIT>",
  "scope": "<short scope statement>",
  "proofObjective": "<what the proof must demonstrate>",
  "proofType": "<no-send-proof|read-only-smoke|lifecycle-sandbox>",
  "proofDataRequired": false,
  "testDataClassification": "synthetic",
  "allowedDataActions": ["read-only"],
  "forbiddenDataActions": ["production-data-read", "real-pii-use", "production-write"],
  "databaseTouched": false,
  "databaseMutationPlanned": false,
  "externalSendsPlanned": false,
  "paymentActionPlanned": false,
  "secretsRequired": false,
  "externalApisRequired": false,
  "validatorsRequired": ["validate-all"],
  "validatorsRun": ["validate-all: ALL PASS"],
  "requiredReviews": ["code-review", "security-review"],
  "rollbackPlan": "<how to revert any sandbox state>",
  "cleanupRequired": false,
  "cleanupPlanPath": "projectos/examples/generated/<name>-cleanup-plan.md",
  "proofEvidencePath": "projectos/examples/generated/<name>-proof-evidence-skeleton.md",
  "approvalStatus": "DRAFT",
  "ownerApprovalReference": "none",
  "decisionNeeded": "<exact owner/advisor decision>",
  "reportPath": "projectos/examples/generated/<name>-proof-plan.md"
}